title	general_category	specific_category	mentee_max	mentor	co_mentors	weekly_meets	description	timeline	checkpoints	prerequisites	banner_image_link
AI Chatbot Development	Machine Learning	Natural Language Processing	3	John Doe (21b1234)	Alice Smith (21b5678)	2	Build an intelligent chatbot using transformer models	Week 1-2: Environment setup and data collection	Checkpoint 1: Dataset prepared	Python programming and PyTorch	https://example.com/chatbot-banner.jpg
Web3 DApp Platform	Blockchain	Smart Contracts	2	Sarah Williams (21b3456)	NA	1	Create a decentralized application with smart contracts on Ethereum blockchain	Week 1-3: Solidity basics and smart contract development	Checkpoint 1: Smart contracts written	JavaScript and Node.js	
Algorithmic Trading Bot	Quant / Finance	Quantitative Analysis	2	Michael Chen (21b7890)	Emma Davis (21b2345)	3	Develop an algorithmic trading system using quantitative strategies and backtesting	Week 1-2: Market data analysis	Checkpoint 1: Data pipeline ready	Python and Statistics	https://example.com/trading-banner.jpg
Mobile App with Flutter	Development	Mobile Development	4	David Kumar (21b4567)	NA	2	Build a cross-platform mobile application using Flutter framework	Week 1-2: Flutter basics and UI design	Checkpoint 1: UI mockups ready	Dart programming basics	
Autonomous Robot Navigation	Robotics / Hardware	Computer Vision	2	Lisa Anderson (21b6789)	Tom Wilson (21b8901)	2	Design and program an autonomous robot with obstacle detection and path planning	Week 1-3: Hardware assembly and sensor integration	Checkpoint 1: Robot assembled	C++ or Python and Basic electronics	https://example.com/robot-banner.jpg
